{
  "schemaVersion": 1,
  "contractVersion": "0.0.0",
  "tokens": [
    {
      "id": "avatar.foreground",
      "type": "color",
      "value": "#ffffff",
      "outputs": {
        "web": {
          "name": "--color-avatar-fg"
        },
        "compose": {
          "group": "avatarPalette",
          "name": "foreground"
        }
      }
    },
    {
      "id": "avatar.overlap.large",
      "type": "css",
      "value": "calc(var(--size-lg) * -0.3)",
      "outputs": {
        "web": {
          "name": "--avatar-overlap-lg"
        }
      }
    },
    {
      "id": "avatar.overlap.medium",
      "type": "css",
      "value": "calc(var(--size-md) * -0.3)",
      "outputs": {
        "web": {
          "name": "--avatar-overlap-md"
        }
      }
    },
    {
      "id": "avatar.overlap.small",
      "type": "css",
      "value": "calc(var(--size-sm) * -0.3)",
      "outputs": {
        "web": {
          "name": "--avatar-overlap-sm"
        }
      }
    },
    {
      "id": "avatar.overlap.xlarge",
      "type": "css",
      "value": "calc(var(--size-xl) * -0.3)",
      "outputs": {
        "web": {
          "name": "--avatar-overlap-xl"
        }
      }
    },
    {
      "id": "avatar.palette.1",
      "type": "color",
      "value": "#00758a",
      "outputs": {
        "web": {
          "name": "--color-avatar-1"
        },
        "compose": {
          "group": "avatarPalette",
          "name": "palette1"
        }
      }
    },
    {
      "id": "avatar.palette.2",
      "type": "color",
      "value": "#247653",
      "outputs": {
        "web": {
          "name": "--color-avatar-2"
        },
        "compose": {
          "group": "avatarPalette",
          "name": "palette2"
        }
      }
    },
    {
      "id": "avatar.palette.3",
      "type": "color",
      "value": "#a65a00",
      "outputs": {
        "web": {
          "name": "--color-avatar-3"
        },
        "compose": {
          "group": "avatarPalette",
          "name": "palette3"
        }
      }
    },
    {
      "id": "avatar.palette.4",
      "type": "color",
      "value": "#6554c0",
      "outputs": {
        "web": {
          "name": "--color-avatar-4"
        },
        "compose": {
          "group": "avatarPalette",
          "name": "palette4"
        }
      }
    },
    {
      "id": "avatar.palette.5",
      "type": "color",
      "value": "#de350b",
      "outputs": {
        "web": {
          "name": "--color-avatar-5"
        },
        "compose": {
          "group": "avatarPalette",
          "name": "palette5"
        }
      }
    },
    {
      "id": "avatar.palette.6",
      "type": "color",
      "value": "#0052cc",
      "outputs": {
        "web": {
          "name": "--color-avatar-6"
        },
        "compose": {
          "group": "avatarPalette",
          "name": "palette6"
        }
      }
    },
    {
      "id": "border.width.default",
      "type": "dimension",
      "value": "1px",
      "outputs": {
        "web": {
          "name": "--border-width"
        },
        "compose": {
          "group": "dimensions",
          "name": "borderWidthDefault"
        }
      }
    },
    {
      "id": "border.width.emphasis",
      "type": "dimension",
      "value": "2px",
      "outputs": {
        "web": {
          "name": "--border-width-emphasis"
        },
        "compose": {
          "group": "dimensions",
          "name": "borderWidthEmphasis"
        }
      }
    },
    {
      "id": "border.width.strong",
      "type": "dimension",
      "value": "3px",
      "outputs": {
        "web": {
          "name": "--border-width-strong"
        },
        "compose": {
          "group": "dimensions",
          "name": "borderWidthStrong"
        }
      }
    },
    {
      "id": "chart.series.1",
      "type": "color",
      "value": {
        "light": "#2a78d6",
        "dark": "#3987e5"
      },
      "outputs": {
        "web": {
          "name": "--color-chart-series-1"
        }
      }
    },
    {
      "id": "chart.series.2",
      "type": "color",
      "value": {
        "light": "#e0602c",
        "dark": "#d95926"
      },
      "outputs": {
        "web": {
          "name": "--color-chart-series-2"
        }
      }
    },
    {
      "id": "chart.series.3",
      "type": "color",
      "value": {
        "light": "#13946a",
        "dark": "#199e70"
      },
      "outputs": {
        "web": {
          "name": "--color-chart-series-3"
        }
      }
    },
    {
      "id": "chart.series.4",
      "type": "color",
      "value": {
        "light": "#a87600",
        "dark": "#c98500"
      },
      "outputs": {
        "web": {
          "name": "--color-chart-series-4"
        }
      }
    },
    {
      "id": "chart.series.5",
      "type": "color",
      "value": {
        "light": "#d0558a",
        "dark": "#d55181"
      },
      "outputs": {
        "web": {
          "name": "--color-chart-series-5"
        }
      }
    },
    {
      "id": "chart.series.6",
      "type": "color",
      "value": {
        "light": "#008300",
        "dark": "#008300"
      },
      "outputs": {
        "web": {
          "name": "--color-chart-series-6"
        }
      }
    },
    {
      "id": "chart.series.7",
      "type": "color",
      "value": {
        "light": "#6250d6",
        "dark": "#9085e9"
      },
      "outputs": {
        "web": {
          "name": "--color-chart-series-7"
        }
      }
    },
    {
      "id": "chart.series.8",
      "type": "color",
      "value": {
        "light": "#e34948",
        "dark": "#e66767"
      },
      "outputs": {
        "web": {
          "name": "--color-chart-series-8"
        }
      }
    },
    {
      "id": "color.accent",
      "type": "color",
      "value": {
        "light": "#0052cc",
        "dark": "#68a7ff"
      },
      "outputs": {
        "web": {
          "name": "--color-accent"
        },
        "compose": {
          "group": "colors",
          "name": "accent"
        }
      }
    },
    {
      "id": "color.accent.background.subtle",
      "type": "color",
      "value": {
        "light": "#deebff",
        "dark": "#1c3a5e"
      },
      "outputs": {
        "web": {
          "name": "--color-accent-bg-subtle"
        },
        "compose": {
          "group": "colors",
          "name": "accentBackgroundSubtle"
        }
      }
    },
    {
      "id": "color.accent.foreground",
      "type": "color",
      "value": {
        "light": "#ffffff",
        "dark": "#1d2125"
      },
      "outputs": {
        "web": {
          "name": "--color-accent-fg"
        },
        "compose": {
          "group": "colors",
          "name": "accentForeground"
        }
      }
    },
    {
      "id": "color.accent.hover",
      "type": "color",
      "value": {
        "light": "#0747a6",
        "dark": "#8cc4ff"
      },
      "outputs": {
        "web": {
          "name": "--color-accent-hover"
        },
        "compose": {
          "group": "colors",
          "name": "accentHover"
        }
      }
    },
    {
      "id": "color.accent.pressed",
      "type": "color",
      "value": {
        "light": "#053585",
        "dark": "#cce0ff"
      },
      "outputs": {
        "web": {
          "name": "--color-accent-pressed"
        },
        "compose": {
          "group": "colors",
          "name": "accentPressed"
        }
      }
    },
    {
      "id": "color.accent.subtle.background",
      "type": "color",
      "value": {
        "light": "#deebff",
        "dark": "#1c3a5e"
      },
      "outputs": {
        "web": {
          "name": "--color-accent-subtle-bg"
        },
        "compose": {
          "group": "colors",
          "name": "accentSubtleBackground"
        }
      }
    },
    {
      "id": "color.background",
      "type": "color",
      "value": {
        "light": "#ffffff",
        "dark": "#1d2125"
      },
      "outputs": {
        "web": {
          "name": "--color-bg"
        },
        "compose": {
          "group": "colors",
          "name": "background"
        }
      }
    },
    {
      "id": "color.background.danger.subtle",
      "type": "color",
      "value": {
        "light": "#ffebe6",
        "dark": "#42201d"
      },
      "outputs": {
        "web": {
          "name": "--color-bg-danger-subtle"
        },
        "compose": {
          "group": "colors",
          "name": "backgroundDangerSubtle"
        }
      }
    },
    {
      "id": "color.background.hover",
      "type": "color",
      "value": {
        "light": {
          "alias": "color.background.sunken"
        },
        "dark": {
          "alias": "color.background.muted"
        }
      },
      "outputs": {
        "web": {
          "name": "--color-bg-hover"
        }
      }
    },
    {
      "id": "color.background.muted",
      "type": "color",
      "value": {
        "light": "#f4f5f7",
        "dark": "#282e33"
      },
      "outputs": {
        "web": {
          "name": "--color-bg-muted"
        },
        "compose": {
          "group": "colors",
          "name": "backgroundMuted"
        }
      }
    },
    {
      "id": "color.background.muted.hover",
      "type": "color",
      "value": {
        "light": "#e4e6eb",
        "dark": "#343c42"
      },
      "outputs": {
        "web": {
          "name": "--color-bg-muted-hover"
        }
      }
    },
    {
      "id": "color.background.subtle",
      "type": "color",
      "value": {
        "light": "#fafbfc",
        "dark": "#22272b"
      },
      "outputs": {
        "web": {
          "name": "--color-bg-subtle"
        },
        "compose": {
          "group": "colors",
          "name": "backgroundSubtle"
        }
      }
    },
    {
      "id": "color.background.sunken",
      "type": "color",
      "value": {
        "light": "#ebecf0",
        "dark": "#161a1d"
      },
      "outputs": {
        "web": {
          "name": "--color-bg-sunken"